emo	val	name	sentence
angry	-3.25	sample_00001927	唐澜你给我解释清楚我怎么不知道这事啊你是不是脚踏两只船
happy	1.25	sample_00001170	其实你不用那么在意我只要能帮到你
sad	-3.5	sample_00001236	虽然还是做到了拒绝他无受
sad	-1.5	sample_00000622	燕子麻烦件事帮我把那手机拿开我不找谁
sad	-2.0	sample_00000427	
neutral	-0.75	sample_00002160	哦这事那可不是吗那
neutral	-1.25	sample_00000145	当然有所不同
surprise	-1.0	sample_00003849	就说你怎么
happy	2.0	sample_00005827	嗯嗯
happy	1.25	sample_00005599	哎哎
neutral	-0.25	sample_00003630	走楼的人都会回来早晚
neutral	-0.5	sample_00000687	每天就天不亮的走了
neutral	0.25	sample_00003914	行那我问你最后一个问题这是最重要的问题
neutral	0.0	sample_00000763	他愿意重新接受一个女人的话也算我一个
angry	-2.0	sample_00004823	刘制片收视率固然重要但是我也不能违背自己
surprise	0.0	sample_00001097	您这摸什么呢
surprise	1.0	sample_00001189	就之前那些事情啊妈你就专门为这些事
happy	2.0	sample_00003820	那就好那就好
neutral	-1.0	sample_00001439	您别管什么传闻不传闻的就算是大海捞针
worried	-0.75	sample_00006103	你奶奶现在这病也得小心着点没什么事胸口给她挂个牌子上面写着家庭住址
neutral	-1.0	sample_00001973	你不要向我泄露
neutral	0.0	sample_00003177	现在的女警
angry	-2.0	sample_00006573	我去不去他那儿工作那是我的事你凭什么替我做
neutral	0.0	sample_00001791	要不然去超市买点牛奶呀
happy	2.0	sample_00001132	可能司令宁同志说的
angry	-2.75	sample_00004648	我给你布置作业你布置完了吗不是你作完了吗谁让你跟着瞎琢磨
neutral	-0.5	sample_00002899	审判长我拒绝回答
surprise	0.75	sample_00005050	奶奶您的意思是我
sad	-1.5	sample_00006726	我们失去了一个最值得信任的同志
neutral	-0.75	sample_00003548	我今天批了一个他们的组织招聘报告
neutral	-1.25	sample_00003769	我这条命早就已经不是我自己的了
happy	2.75	sample_00002941	咱俩没有血缘关系
neutral	-0.75	sample_00000059	等待着抓捕黄红兵
worried	-1.5	sample_00003670	唉呀
neutral	-0.5	sample_00006749	目前还没有按你吩咐的我每天早上晚上都带着他们去吃饭还安排人带着
worried	-1.25	sample_00004278	你不觉得有特别的用
happy	2.5	sample_00004159	你说的什么时候挣钱给我花了什么时候好吃给我吃吗
happy	3.0	sample_00001354	呵呵呵
neutral	-1.0	sample_00001894	就是我的命不爱你
neutral	-2.25	sample_00003967	我是一个隐藏
surprise	1.5	sample_00000174	什么
neutral	-1.0	sample_00000934	他自己私自外出害得我们开天窗
happy	1.5	sample_00003551	随便问问真没吃饭想不想吃
neutral	-0.5	sample_00004808	若昀你千万别多想
happy	1.0	sample_00003233	挺好的要不
worried	1.5	sample_00003619	好做手术啊好这年纪大了就怕做手术
worried	0.0	sample_00000352	孩子岁数有点大了她着急了你岁数也不小了
sad	-3.5	sample_00001111	千万别误会他都瞎说的
angry	-1.75	sample_00001235	我哪赖着不还了我这不正要还呢吗
angry	-2.25	sample_00003289	我是要工作的
happy	2.0	sample_00000397	我做了一天分析好累啊今天就不打扰你们了有时间
happy	0.5	sample_00000299	我不介意的
neutral	-1.25	sample_00001723	不能吧安迪姐不是那种说三道四的人
angry	-2.0	sample_00002924	找我你信不信我把这些东西放下我就转身就走
happy	1.0	sample_00002297	好
angry	-1.25	sample_00003531	不明则以一鸣惊人啊名的都是惊世骇俗啊
sad	-4.25	sample_00006197	我有梦你们别再问我了你要再问我的话我要自杀
sad	-4.0	sample_00005441	这么多年他隐姓埋名真是我的生活我就是在陪着一个活死人想到我逃不掉他杀了追求我我也喜欢的人你说我跟谁说说了他也会杀我
angry	-2.0	sample_00003051	再去看
neutral	0.25	sample_00000430	就想当个初次的出事
angry	-1.25	sample_00005278	我就放床头
happy	1.75	sample_00004053	原来这两个人是郎情妾意呀
worried	0.25	sample_00006513	院长
angry	-2.75	sample_00001016	他们真是太过分了假扮假释召开什么新闻发布会来骗
sad	-4.0	sample_00002466	这你让亏还
neutral	-0.5	sample_00002186	不是这样的这对于我来说是一个仪式
sad	-3.5	sample_00004489	婆你应该告诉我一声就算是分手你也可
sad	-3.0	sample_00005858	对不起你和妈
neutral	-0.25	sample_00005890	丁老谭跟我说袒露真相未必是美德有时候真相
angry	-1.5	sample_00003549	我自愿上钩的
neutral	0.25	sample_00005862	分当只是
angry	-1.75	sample_00005530	不委屈是个这二百零三来了个这
worried	-1.25	sample_00005971	我琢磨着是不是桃子
neutral	-0.25	sample_00006829	你跟王素芬说一声我就不进来告别
happy	1.25	sample_00006292	不过了他今天不是要陪你去看牙吗刚才在院子里捡到的一个钱家
happy	1.5	sample_00006118	但可以留住老员工又可以吸引新员工
happy	1.75	sample_00006202	我也洗疙瘩说
sad	-1.5	sample_00003059	你能不能今天就放我的家
happy	1.75	sample_00000628	走吧
angry	-3.25	sample_00005714	他怎么能干这种事呢我早就应该想到
happy	2.0	sample_00000030	没错然后回到我的身边
worried	-1.0	sample_00005945	姐秦飞觉得只要能继续参加比赛就行可是我可是我觉得这样太毁了
sad	-1.25	sample_00002425	如果真的是这样也许分开不是一件坏事
sad	-1.25	sample_00003560	真不是客气你说我们家姗姗吧在美国交了男朋友了
sad	-2.25	sample_00000741	这并不诚实我答应我的妻子我一定会骗了回到他的身边他也信于我
sad	-4.25	sample_00001233	我都一直很难过可我还
worried	-1.0	sample_00006774	有我想一定会有好的办法
neutral	-0.25	sample_00000751	说是外在好才能让人愿意探究内心
worried	-1.5	sample_00000697	行吧我现在就赶回去你们等我到了再开镖
happy	2.0	sample_00002358	我很长时间都没看到你演出了
neutral	0.5	sample_00004064	要换房子吗我突然给你找了几套
angry	-0.5	sample_00003855	别这么说我婆婆再说这钱也不是人家给我的
worried	-1.75	sample_00005237	我妈为什么住院啊
surprise	-2.25	sample_00005482	不可能你来三亚第二天
neutral	0.75	sample_00003710	是张老
happy	2.75	sample_00004264	哎
happy	1.5	sample_00004005	
angry	-3.25	sample_00003495	那不是什么好人好事我老记着他干吗
happy	1.75	sample_00002156	这位太太您想看什么
happy	2.75	sample_00005683	是对打个电话
happy	1.75	sample_00001405	对对对对没错
happy	1.75	sample_00005498	你就去忙你的吧祝你一切都顺利
worried	0.0	sample_00001128	出去就先给你找个工作吧不然总在面前晃来晃去的早晚被弄得精神
angry	-3.0	sample_00004241	不练曲吗如果不是因为我良宗到现在还是那个乐队
happy	1.25	sample_00000209	哼
worried	-0.75	sample_00000246	你我觉得你状态不对呀
neutral	0.25	sample_00006359	那好嘞行那你那个你把你那个助理的那电话号码你发我手机上吧我明天跟联系就行啊
happy	1.25	sample_00003874	快要不行了要告别人事那种
happy	1.0	sample_00006105	手挺凶的特别硬气的啊
worried	0.0	sample_00005508	那换人演吧那换人演怎么能保证还是那个都教授还能接戏呢
angry	-2.5	sample_00001468	跟他走是我昨天问你的你觉得九天他怎么样是你跟我说你觉得他
angry	-2.5	sample_00002632	清楚我跟你说清楚不管你是从哪里得知我们家在寻找亲人从现在开始希望你
neutral	0.0	sample_00000865	觉得遗憾或者或者恐慌
angry	-2.0	sample_00000331	你这样回来的长沙那一单要不是我把警察引开你走得了吗
sad	-2.5	sample_00000019	喝多了伤身不喝多我伤心
worried	-2.5	sample_00001371	画了画了钥匙我真的生了一个不健全的孩子那他这辈子就完了
happy	2.0	sample_00000927	小蚯蚓你什么时
angry	-4.5	sample_00002846	能不能够消停会儿能不能够不让他折腾了
angry	-3.5	sample_00004386	你胡说什么你出去出去
angry	-3.25	sample_00006672	哪儿可像
surprise	1.0	sample_00002348	啊啊
angry	-0.5	sample_00006198	傻傻呀我在乎花这个钱吗我那也就是气话
happy	2.0	sample_00006710	谢谢干妈夸奖你等我的好消息
sad	-1.75	sample_00003702	那是我最后的机会
happy	0.25	sample_00002837	韩让子是撞上的忘到我现在这儿
worried	-0.25	sample_00000053	吵架了
worried	-1.75	sample_00003138	季疯子我就知道
worried	-0.5	sample_00004248	我们跟他一起去买菜但是我昨天确实有提前约好的事情必须得出门就没有去
worried	-1.0	sample_00002914	要不做的话那桃子将来绝对没有好果子吃
neutral	-0.5	sample_00006852	就是你不再逃避了那一切才会
sad	-1.5	sample_00001355	嗯现在有机会了有机会实现你梦想了
surprise	-0.5	sample_00005114	好我也季平
sad	-2.0	sample_00004326	预言家那我们就不用再见面了如果是亲家
sad	-2.0	sample_00006524	我实在是没办法了这日子都要过
worried	-0.5	sample_00006143	妹妹啊不是支撑每个月都给你生活费吗你干吗要那么辛苦工作
happy	2.25	sample_00006627	我准备给小新一个惊喜什么
sad	-4.25	sample_00000096	所以我现在也没有办法说服自己再回到他们家一想到我爸苦苦婆心地劝我说要跟他好好过他们还这样说我爸我真的
worried	0.0	sample_00006194	有空的我们就只吃喝喝聊聊天喝喝茶一直到老好吗千万不要说那种奇奇怪怪
happy	2.0	sample_00005067	我从头发丝到脚受的尖都嚷嚷着想要亲她想要
sad	-3.25	sample_00005681	回国这么长的时间我问过你那么多次你有那么多机会告诉我你为什么不说呢
angry	-2.0	sample_00003429	我越反击他越来劲你信不信本来一开始呢我就以为他就闹闹小脾气你就算了哪知道他跟我来这一出啊我已经想好了反正呢我已经把拉黑了他爱闹就闹闹了他消停
happy	1.25	sample_00004720	大姨您能宽宏大量
happy	1.0	sample_00003677	怎么增加安保措施啊给每个大夫
angry	-1.25	sample_00004972	好了我被利用了你也被利用
neutral	-0.5	sample_00003396	无所谓反正他拿的工资都是你的年终奖
worried	-1.75	sample_00001884	就我奶奶那饭量我还能吃上肉吗更别说海鲜了
neutral	-0.25	sample_00001997	但是现在就让我们两个人确定关系我觉得我还没有做好思想准备
angry	-2.25	sample_00001681	不是你跟着他干什么呀你
neutral	0.5	sample_00003095	你怎么没想着再找个伴呢
worried	-0.25	sample_00003133	你跟沈大夫的事其实呢我都已经过去了真的就是你高兴我就高
surprise	-1.25	sample_00000549	你是说渠道上临时改变主意把货都铺回去了
neutral	0.0	sample_00000144	是威杉矶猛灵感的女儿相处七年了大家都说
happy	1.5	sample_00000141	这倒是啊
angry	-1.5	sample_00001412	为什么我一定得会啊我要是学会了我也不做给你吃
neutral	0.75	sample_00003600	既然这样我就需要下面的子公司全力地支持
surprise	3.0	sample_00004348	你真的
neutral	-0.25	sample_00002222	虽然活发制人都可以最重要的是你自己想清楚
happy	1.5	sample_00000206	女儿要带男朋友来见我我给她爸
happy	2.0	sample_00003196	我刚才就想到了一个特别好的吧
worried	-2.0	sample_00000033	你明知道龙州队的队员现在都还是群菜鸟
neutral	0.25	sample_00005014	他会有爱心人士来探望大家所以要求明天每个人的着装要干净
neutral	0.25	sample_00001741	这还用问吗我知道他们是交往了十年的恋人了我最近我听说
angry	-2.25	sample_00005022	你什么意思啊
angry	-3.25	sample_00006897	想得脏还是你做
sad	-2.25	sample_00006958	只是我影想通了我觉得我跟林杰了其早就已经
worried	-1.75	sample_00003801	樊姐跟人喝醉成那样回来又哭
angry	-3.25	sample_00003164	我不是你儿子念我念我你不是孙纳说我
neutral	0.0	sample_00004681	今天早上刚给我发的短信说他今天要搬
sad	-1.25	sample_00005826	已经很多年都没有联系了
surprise	-0.5	sample_00006769	高
surprise	-0.5	sample_00003210	对门的那个帅哥是我哥怎么会有这么奇葩的事情发生在我身上太离谱了
surprise	0.5	sample_00000525	
worried	0.0	sample_00006486	那他肯定该难受了我看得出来他那么依
neutral	-0.25	sample_00002171	房子太贵我买不起
neutral	0.25	sample_00002019	得嘞就这么着
angry	-3.0	sample_00004829	你原来不找吧人家觉得你眼光高你挑现在看来不是眼光的问题呀
happy	1.5	sample_00004287	客户的航班提前了如果你今天不走的话
worried	-2.0	sample_00003927	打不通不会真出事了吧
neutral	0.75	sample_00003325	据说他的上一任呢还是个台湾的摄影师
worried	0.0	sample_00004857	他们俩吧就像两个重感冒的人他会互相传染
happy	1.0	sample_00006880	我是中国人本土的
angry	-2.75	sample_00000198	爸如果你再不说实话的话我只能跟院领导打报告取消你的学习资格
sad	-3.0	sample_00005168	每天我实在受不
angry	-2.0	sample_00002220	你去追呀你坐在这里跟自己较什么劲
neutral	0.0	sample_00004556	基本上都是他的钱还的
sad	-3.0	sample_00003219	就指出我的不好
worried	-0.75	sample_00006503	可是从你嘴里喊出来怎么就
neutral	0.5	sample_00004166	就这么小打一圈电话下来
neutral	-0.75	sample_00000474	洪先生文章上香当阴谋但在处理问题时感情胜过理智也许女人都是如此
happy	2.5	sample_00002683	咱俩是同事啊又是男人
worried	-0.25	sample_00005958	这一步嘛我要不把它卖好我走着不放心
angry	-1.25	sample_00001755	我们说王建国你什么都没带这傻了吧没劲做了吧
surprise	-1.25	sample_00001373	二十万不是那你们课没有什么减免方案优惠
neutral	1.25	sample_00004156	我对不起对不起我最近事太多了我真是给忘了给你添麻
neutral	-1.0	sample_00001666	对我要跟你说这项链的事我翻过他抽屉了
happy	2.0	sample_00002830	单桌都已经准备好了
neutral	-0.25	sample_00000226	也不会在乎
neutral	-0.75	sample_00006766	他要一个人离开上海
surprise	-0.75	sample_00000669	你们这么看着我干吗呀就是一女的就得和我有点什么
angry	-2.25	sample_00005028	我的事不用你操心他伤害了我那他也别
neutral	0.25	sample_00005885	好啊怎么也没见你对我的事情这么伤心
angry	-1.75	sample_00002361	不过以前不是就是王祖蓝要么就是你
worried	-1.0	sample_00006553	为什么陈放有关吧
happy	2.25	sample_00006602	
angry	-2.5	sample_00002112	你就作吧你说你跟一个长辈跟个老太婆你有什么好斤斤
worried	0.0	sample_00004810	行了你别渗着了赶紧回去
happy	1.5	sample_00004322	高飞哥你还没起床啊不好意思吵到你了电视台给我们打电话
angry	-3.25	sample_00000753	您为什么不放两个蛋啊你是不是觉得我没有资格吃两个蛋啊我以前做泡面都是放两个蛋好吗而且都是茶叶蛋
neutral	-0.75	sample_00002232	我觉得古新一个人挺不容易的
happy	1.25	sample_00001860	春儿你干
angry	-1.5	sample_00005412	就这几句话
happy	2.25	sample_00004847	换回护照那不更是锦上添花吗
angry	-0.25	sample_00006678	你给不给面子啊
neutral	1.25	sample_00003240	我不瞒你我看咱们环球地理第一本杂志这话说是在十三四年前了
neutral	-0.75	sample_00000961	嗯对行
happy	1.0	sample_00004286	如果喜欢我送的话我以后每天都送
neutral	0.5	sample_00003085	现在当然以后更是我愿意做出的一些隐忍跟妥协都是因为
angry	-2.75	sample_00005652	出租车司机尿急非要上
angry	-2.5	sample_00006748	好好我的感受我很开心我很高兴我很高
angry	-2.0	sample_00000936	他是你爷爷那个小混
sad	-1.75	sample_00001596	结果他过了我被举签了
neutral	0.0	sample_00001818	想要什么答案就给他什么答
neutral	0.0	sample_00006586	一定要让他们再看报告的那些人跟着
neutral	-0.75	sample_00000577	你们没关
sad	-2.5	sample_00005505	我就是受不了自己少了一条
neutral	0.5	sample_00002119	因为它那个奥运公园旁边不是有个湖嘛我到时候呢可以跟它骑骑自行车
neutral	-0.25	sample_00000999	最让我难过的是你不快乐
happy	1.5	sample_00003120	房哥找我啊有事要跟我说呀
angry	-3.0	sample_00000617	考试前让你请家长来
sad	-2.25	sample_00000203	他是我爸的大姑奶奶一辈子没结婚
angry	-2.25	sample_00003486	你要不占我车位
worried	-0.5	sample_00003995	嗯猜不猜的倒也无所谓关键是欧阳现在好像
neutral	0.0	sample_00002393	谢谢安总的信任
surprise	-0.25	sample_00004670	
sad	-3.75	sample_00004384	他一直觉得我不是一个孝顺的儿子其实我真的很想我爸我也很想我妈
neutral	-0.75	sample_00006851	我说什么来着这女儿大了人家自己我
happy	1.25	sample_00001539	所有的好的队员都到我们恒
neutral	0.5	sample_00002860	并不是因为我害怕我胆子小
sad	-1.5	sample_00006747	但是妈就跟你说一句话啊
neutral	0.0	sample_00005386	好
happy	2.25	sample_00005673	我以为被小偷偷走了呢
worried	-0.75	sample_00000706	我呢不仅不会去我得警告你一声那天不要闹事啊
angry	-2.25	sample_00000365	你让我相信你我相信了
angry	-2.5	sample_00001601	你马上跟他断绝关系以后这种事永远不许再发生
happy	2.5	sample_00006635	我也这么认为的
angry	-2.75	sample_00001173	平时他一回来就都不一样
angry	-1.25	sample_00005696	爸爸我事怎么办呀你公司家大业大你留个
neutral	0.0	sample_00002331	我刚看她年轻时候照片
happy	1.0	sample_00000568	没事了现在不疼了我今儿为了迎接你来化了个妆
happy	2.25	sample_00006804	哈哈
angry	-0.25	sample_00004819	还通报嘉奖你就等着吧
neutral	0.0	sample_00001813	您为什么要学英语啊
worried	-0.25	sample_00002413	我想往家澳门走一趟
neutral	0.75	sample_00003430	这个地方的老板是我一个好朋友所以很
worried	-1.5	sample_00004312	要手术好像也是有一定风险的再灌注损伤是不是
worried	-1.5	sample_00006196	最后一次可可能就是他失踪那个晚上
angry	-2.5	sample_00001811	你毁我
neutral	0.0	sample_00000087	它的成本是多少你的公司的你是运作呀在那些老将眼里那都
worried	-0.75	sample_00003407	我去你家找你对不起是非得已我希望你给我一个解释的机会
sad	-3.25	sample_00005975	但知道咱妹妹出事了他平时好好的不来遛话就是来电话什么意思他不就是还想看咱们笑话吗
angry	-2.0	sample_00004919	出这么一个孩子来以为我一定会
neutral	0.75	sample_00004167	哎
neutral	0.25	sample_00006756	咱们从小事做起
neutral	0.25	sample_00002433	现在他的钱已经要回来了他想拜托我们
sad	-3.25	sample_00004142	昨天他突然告诉我
angry	-2.0	sample_00003648	你们愿意接触不接
angry	-2.5	sample_00000493	全玩刮裂枣没一个能看上眼的
angry	-3.5	sample_00001442	节目的小说去我和爸妈开饭店去总之我就不想当个倒霉医生
worried	-1.5	sample_00003081	怎么会呢
sad	-2.5	sample_00005309	我爱你我我真的不能没有你真的宝贝如果如果在必要的时候哪怕我付出生命我都愿意真的老婆我爱你真的行行那我明天在家等你
sad	-1.5	sample_00002518	倘若他在的话一定会支持我的
neutral	-1.0	sample_00000582	
angry	-1.75	sample_00001769	这这
angry	-2.0	sample_00005548	其实这样着说话不腰疼啊谁家踏上这么个玩意
neutral	0.0	sample_00000777	对呀
angry	-1.0	sample_00001389	说现在女生都有病
neutral	0.5	sample_00000468	爬你别在那儿干了出来到我餐厅打工
angry	-1.25	sample_00001320	会爆发你自己说吧你今天到底问什么旗票问题把你们家孙建才
neutral	0.0	sample_00005465	纠缠于那些办公室斗争
happy	1.25	sample_00002877	没准一会儿咱们神勇的队长会不会一进门说
neutral	0.25	sample_00003118	小曲嘴巴虽然是很坏可是这次还真帮对了
worried	0.0	sample_00004402	朱云把孩子都扔下跑了你没点不
neutral	-1.5	sample_00006561	比男人狠
worried	-1.75	sample_00004182	你早晨要上早班你你晚上早点回来呀你
angry	-2.0	sample_00003367	我就胡闹了你不是老说我胆小怕犯错误吗我就犯一次错误
angry	-1.5	sample_00000602	我还没有说完
neutral	-1.75	sample_00000731	你让一个混蛋去评价另一个人是不是混蛋你觉得这事靠谱吗
neutral	0.0	sample_00000842	结果再看看有什么甜点艾斯之类的好啊你帮我配些两人份
sad	-1.5	sample_00003139	去啊我想你刚好想
happy	1.0	sample_00001274	今天我新搬过来以后我们就是邻居了
neutral	-0.5	sample_00002474	也是他的口头禅就是
neutral	0.0	sample_00002046	他们怎么在一起的
angry	-3.0	sample_00006121	我不去
worried	-2.0	sample_00005219	你现在过去只会让家属的情绪更加失控甚至全部迁怒
sad	-3.25	sample_00004125	对不起
happy	1.75	sample_00001383	曾经像我一样迷失过的朋友希望他们早一点找到自我
sad	-3.0	sample_00001557	我爸妈吵架了
sad	-0.25	sample_00004918	这样不看着家人这样不看着往事谢谢你还来不及
angry	-4.5	sample_00006862	开什么开
neutral	1.25	sample_00006847	好工作还怕找不到吗是不是
happy	0.25	sample_00001948	听说
happy	2.5	sample_00001175	好这里东西还挺好吃的好像我吃得比你
sad	-1.75	sample_00001003	那我呢
happy	1.5	sample_00000603	特别特别地存在他对你呢有着特别特别的
neutral	0.0	sample_00005308	我爹说家里来了客叫我回来挑水
neutral	0.5	sample_00004586	道长以前是不是
sad	-1.75	sample_00004292	就在那段时间里我丢失了自己的热情
neutral	0.75	sample_00002028	这是我们自己做的月饼
neutral	0.25	sample_00005680	价儿我果然你
neutral	1.0	sample_00002174	不要放糖
angry	-1.75	sample_00001404	但是你也不能这样啊是的你是不能拿李兰英怎么办但是这事发生之后你立马跟我说一声也好
neutral	0.25	sample_00006535	你不就是想找个女朋友带回家给父母看看表表孝心吗漂亮一点不好吗
happy	2.0	sample_00003662	这多么的有分量是多么
worried	-0.25	sample_00003388	牛牛听说你在外面受了不少的
happy	1.5	sample_00006551	彼此彼此
worried	-2.0	sample_00004669	他的红包是我硬塞给他的而且后来他
neutral	-0.25	sample_00003788	我上午刚给他打过电话他说
angry	-2.75	sample_00004017	过过稿啊就这
angry	-2.5	sample_00003398	我们就是这么杀我们就是这么在乎人的生死如果不是这样你早就死了
happy	1.0	sample_00001021	我叫巴拉有空到算了酒吧听我唱歌我请客
worried	-0.25	sample_00006746	女孩子干急诊有很多具体的困难面对这种紧急事件你虽然没说什么但说心里话
neutral	-0.5	sample_00004415	负责的病人临时出了问题就只好跟哥们一起来喽对了我跟赵医生好的事可千万别
neutral	-1.0	sample_00003857	我打岔填高了你不换身衣
angry	-2.25	sample_00001808	那警察你
sad	-1.25	sample_00003941	我根本就没有自信我害怕被拒
worried	-0.75	sample_00006067	我感谢你帮我警我但是有句话我要说在
angry	-2.5	sample_00006822	你怎么能带他来纽约呢
worried	0.0	sample_00004037	对了美食周刊的记者团什么时候到
sad	-2.0	sample_00005281	求求你放过我们
happy	1.25	sample_00000305	好好
happy	1.75	sample_00004554	你记不记得有一个美食评论家还
angry	0.5	sample_00006343	来商量什么呀又换了别人早就高兴
angry	-3.25	sample_00001978	我看你这几天就不对劲你吃醋
happy	1.5	sample_00004044	把一辈子旗袍了最看重的就是
neutral	-1.5	sample_00000915	我每人家猜我就猜火吧反正我
neutral	-2.25	sample_00001480	就算我让你娶意大利以你的条件也未必签得下来啊
happy	1.25	sample_00000278	不客气好饿我们还是叫外卖
angry	-1.75	sample_00001731	就算您罢免了我我也不需
happy	1.5	sample_00005537	这人一杯奶茶再来一盒婷婷圈
angry	-3.75	sample_00005672	非让你从爱情片直接演成恐怖片你不觉得你自己的样子很恐怖
neutral	0.0	sample_00003647	如果可以自己出去租房子的话我可以为你负担一部分房租
angry	-0.25	sample_00000573	是啊对啊
happy	2.75	sample_00001556	蔡老师起了假现在艺考但是很低
angry	-2.5	sample_00003525	你千辛万苦这么跟着我
neutral	0.25	sample_00003620	不好意思啊这外卖
angry	-2.5	sample_00005911	按照规定我在允许的时间范围内进行装修请问我错在呢
worried	-0.75	sample_00006184	您要回去当大教授了还能参加我的婚礼吗
neutral	-1.5	sample_00002427	是管你你要是不回家总得跟我说一声吧省
worried	-2.25	sample_00004952	你也不能跟他提
neutral	0.0	sample_00002493	对对对对
sad	-1.0	sample_00000659	我请问你也别太自责了还不是因为我岁数太大了
neutral	0.0	sample_00001940	是这样的啊我吧我从小我就教育我们桃子
happy	1.0	sample_00002311	但是在这里我必须要向在座所有人坦白
sad	-2.5	sample_00000619	我们俩在一起十二年了在我跟你提出离婚的时候
sad	-1.25	sample_00000592	那他打算怎么办
worried	0.25	sample_00002694	确定但是我觉得呀这个跟他当选这个平面模
worried	-0.5	sample_00000067	怎么了不过还是因为
sad	-2.25	sample_00004751	我这一直在我身上
happy	3.25	sample_00001642	太谢谢飞哥了
neutral	-1.75	sample_00003691	太低估了你自己尽管那位魏先生也还算是一个不
