emo	val	name	sentence
neutral	0.0	sample_00003884	来不及也得去啊你又不是不知道像这种
neutral	0.0	sample_00001277	要不你先打电话给老板娘呗
angry	-2.75	sample_00004875	这说你们没有错说我父亲
worried	-1.25	sample_00002337	哎
sad	-2.5	sample_00006081	我问错了我不该
happy	2.25	sample_00002652	明天星期六南湖公园划船你跟我一起去
neutral	0.0	sample_00001020	我我们那都过去那么多年了早就过了
surprise	-1.0	sample_00005163	今天就手术了
neutral	1.75	sample_00004220	也就是说你能看得到我啊好吧我知道了一会儿见
neutral	0.0	sample_00003612	那我可以问问秦皇岛的警察让他们帮着协查一下邮件和刘东还在不在
sad	-2.75	sample_00003473	你不了解管理他这个人混起来
happy	0.5	sample_00003243	我在台上唱歌最好没人听我
happy	1.5	sample_00003441	你跟我吃饭呢还能乐出来这说明呢你不是很
neutral	-0.5	sample_00000703	你为什么还跟你王同学装作情侣
sad	-1.25	sample_00001074	要不然一天一天这样过那我觉得缺了自己不行其实没有人是不能替代的
sad	-3.0	sample_00005592	没看到你哥哥连家都没
neutral	0.0	sample_00000543	今天我们庭审的内容是什么
worried	-1.25	sample_00006433	进公司呀都是什么名校毕业我这发像我这种排不上号学校出来的回头再给淘
angry	-3.25	sample_00006153	快给我出
angry	-3.25	sample_00003211	看着还是正常人基本上可是太没有素质了
neutral	-0.25	sample_00005391	别
neutral	-0.5	sample_00003163	帮他穿的钱我就给你
surprise	-0.25	sample_00003007	
surprise	-1.0	sample_00000657	韩总又来了
angry	-4.5	sample_00002008	你说给你安排这个这个不偿带不成好不容易这一个好的你又来这一
angry	-2.75	sample_00004393	我跟你讲从现在开始从我家搬出去知道吗我不
sad	-3.25	sample_00003761	哥
neutral	-0.25	sample_00000479	这些照片都是谁剪的
angry	-1.75	sample_00002420	但他是个病人你也听到他是怎么胡说八道你说我怎么
happy	0.5	sample_00003048	谢什么
happy	1.75	sample_00002496	不得得我招招了
happy	1.75	sample_00000601	真看不出来
angry	-4.0	sample_00001475	是我爸妈盲目乐观给我取了这么个名字这是个笑话我一年挣得没你一天花得多我当然活得累
neutral	0.0	sample_00000738	卷宗上描述的那枚钻戒
neutral	-1.75	sample_00005972	到最后呀别
worried	0.0	sample_00001026	妈这倒是个问题就没有别的什么
sad	-2.25	sample_00001628	您这一辈子最疼的就是两件事
sad	-2.75	sample_00002059	死了你就一点都不
happy	1.75	sample_00003768	那个盒子呢叫做记忆的
angry	-3.0	sample_00000073	保玉小强我今天把所有的事情都跟你
angry	-0.75	sample_00006227	这么快
worried	-1.5	sample_00004371	不长此以往下去的话你的身体和心理是承受不了的我真的担心
neutral	-2.0	sample_00000675	未来不会再接你的活
angry	-3.5	sample_00002874	小田人与人之间的事情没有你想的那么简单你的问题我回答不了我也希望有个人能给我
surprise	-0.25	sample_00003957	您您是
happy	2.25	sample_00004603	没事你的事就是我的事嘛
happy	1.5	sample_00004440	小强你是不是跟那个老师接上头了
angry	-2.0	sample_00004447	我很是非分明站在你这边我冒着跟我妈断绝母女关系的危险我把她数落一顿
angry	-4.5	sample_00004227	他就认钱他还认什么呀一个字数两个字太俗三个字
sad	-2.0	sample_00002933	他没有博我明白
neutral	-0.5	sample_00000796	说得特别简单真实就是给我钱吗
angry	-3.75	sample_00005704	就算我以前什么你我现在也不生你了你给我滚远点
happy	2.0	sample_00005860	是这样的大婶说有个女的专门给他们送去了二十万
neutral	-0.75	sample_00001780	我这不是送你礼物
worried	1.25	sample_00001270	不过我要提醒你的就是这么长时间才想到约你见面我估计是条件
neutral	0.0	sample_00003105	那个是咋跟错了一个是一个是f你知道吧就差一横
happy	1.5	sample_00001943	不是我
happy	0.75	sample_00004232	我们想
angry	-2.25	sample_00004776	不用凡事如果你说谎发誓
surprise	-0.5	sample_00000508	等会儿你怎么又是你啊
angry	-2.5	sample_00004734	苏二妹工作不是过家家我嘱咐一个员工离职的钱提前告诉我
happy	0.25	sample_00003129	不会的
neutral	-0.5	sample_00005021	我也说不准但是也就是感觉吧我觉得崔莹躲我们
angry	-1.0	sample_00003195	你是新来的
sad	-2.25	sample_00000665	大哥不错了干净我对不起心从一开始到现在每一件事情都有
angry	-1.25	sample_00002764	周氏率地观众没人看谈什么感动
angry	-3.25	sample_00004867	怎么了女人就是强盗逻辑你以为呢我告诉你我跟那谁捡回我们俩人第一次离婚的时候捡辉他妈进我们家二话不说啪啪左右开弓
worried	-1.25	sample_00004710	唉你都找了这么多年了放弃哪有那么容易啊你真的能放弃吗
neutral	0.0	sample_00003200	小帆现在有难处要是能帮
angry	-2.0	sample_00002576	我是那种人吗我告诉你我王雪梅说到做
angry	-4.25	sample_00000867	你要是今天走出这个门的话你就别来找我
happy	2.25	sample_00006622	要不再给你做一件那不是砸自己的牌子吗放心吧料我
happy	2.25	sample_00002448	来选择的话我现在就可以选
happy	2.75	sample_00006310	我能给你工作就很开
sad	-1.75	sample_00006731	说什么呀跟你们一起说父母狠心吗可是他们能怎么办呢面对一个先天缺陷的孩子医生都无能为力他们能做什么
happy	2.75	sample_00003005	从小讲
neutral	1.0	sample_00003423	兄弟到别处来一趟吧我有事
sad	-1.75	sample_00006782	走走
neutral	-0.25	sample_00003692	谁先认真谁就输
happy	1.75	sample_00002476	名字呢只是一个代号哪有那么多规矩啊想怎么样
angry	-2.25	sample_00005353	无所谓那我就回去我歌手于飞
angry	-1.75	sample_00003082	那你就不能体谅
neutral	0.5	sample_00003230	自己相当于嗯给自己打开了一个打开一扇门
angry	-3.0	sample_00004067	是你现在是归王保管我说不了你什么了我发现你最近是越来越活跃了啊以前多稳重啊
happy	0.75	sample_00000558	时候我都会把这个盒子找个地方
neutral	-1.5	sample_00001193	以后别去了让师父知道了伤他的心
sad	-1.0	sample_00004933	不可能了孩是笑着说的我听着有点难受
neutral	0.0	sample_00000723	你能不能到刚才那个人屋子里面去把他护照
neutral	-0.25	sample_00002051	知道吗我以前觉得我人生中最痛苦的境遇可能就是你离开
angry	-3.25	sample_00005825	别跟我扯淡
sad	-3.25	sample_00002991	我不想见他
happy	1.75	sample_00006086	成阔太太了
angry	-2.5	sample_00000838	吃的开玩笑我从小到大最恨的就是糟蹋粮食
neutral	-0.25	sample_00003382	琢磨这点你也该上班了方便
happy	1.5	sample_00004132	曾主任说了咱们急诊室比较特殊所以这次是半年
happy	2.5	sample_00006450	妈好看吗
sad	-2.25	sample_00003970	我话又说回来了你说我要好好过日子你也确实望尘莫及真的你说我跟苏青你说我们俩多好啊
angry	-2.0	sample_00006010	开玩笑呢我是找你来
surprise	-1.5	sample_00000240	真猛啊这罪你都受得起
angry	-3.5	sample_00002829	陆远你有完没完了
happy	2.0	sample_00005366	你这人有一优点
worried	-3.0	sample_00002882	我要是死了你咋办呢就你这样的要没点没点出息哪个姑娘愿意嫁给你呀
worried	0.0	sample_00006536	我现在还没能确定我的记忆很模糊我一定会把这个
happy	2.0	sample_00006670	我真的一直都挺不好意思想跟你道歉
happy	3.0	sample_00005759	那不得了你还犹豫什么呀你
neutral	0.25	sample_00002278	我吗我在家里
worried	-1.25	sample_00003893	这藏着就怕别人知道所以这段时间你多陪陪他吧我也担心他
sad	-1.75	sample_00002212	让你能好过点是吗
happy	3.25	sample_00005948	你不顾身你说哪个女孩不希望身班养这么一个白
angry	-2.75	sample_00006617	旱涝保收
worried	1.0	sample_00000088	总得有个理由吧那我上面还有老板呀你得让我跟他们有个交代
neutral	0.25	sample_00003679	把别人想得太好但是也别把别人想得太坏
worried	-0.5	sample_00001529	我呢希望他已经
sad	-3.0	sample_00003994	你来就是跟我说这些
angry	-2.5	sample_00005396	我一直在利用你你这个傻瓜
neutral	-0.5	sample_00002173	我就是想带他来玩玩
angry	-2.0	sample_00004316	遇到你这样的女
happy	1.25	sample_00000349	好吧现在就剩我们两个人去了也好
surprise	-2.0	sample_00001838	你说什么
neutral	0.25	sample_00002207	每个人都可以按照他们想的去做
angry	-2.75	sample_00006301	你凭什么说我这么做就只是
surprise	-0.5	sample_00004671	不会吧不可能樊小妹不是这种人
worried	-1.5	sample_00001923	话这么说了你怎么现在总感觉我自己两头
angry	-3.5	sample_00002563	跟这种老板娘混有啥意思
neutral	1.25	sample_00001877	你想的爸爸
happy	2.75	sample_00002562	早说呀
neutral	-1.75	sample_00003454	一分钟这道菜一共
happy	2.5	sample_00000075	我大专毕业开苦耐劳认真努力
angry	-2.25	sample_00001282	阮小姐
angry	-2.5	sample_00005916	不可能不见面只有一种情况那就是她还有另外的男人
angry	-2.5	sample_00000604	你对得起他吗
angry	-1.75	sample_00003634	你这说什么呢你在这
neutral	-0.5	sample_00006023	
angry	-0.75	sample_00002459	天天挨打根本就不怪别人
neutral	-1.75	sample_00001914	你呀也别找了
neutral	-0.5	sample_00001928	只有黄红兵和那个女的的身份未确定但他们很有可能
neutral	0.5	sample_00000667	急着要买药酒敲门没人
neutral	0.0	sample_00002422	北的面前胸
happy	1.75	sample_00003214	所以不会有压力
angry	-2.75	sample_00001975	今天我算是遇上奇葩了你爱道不告
angry	-2.5	sample_00002002	弄得乱七八糟的让所有人都不舒服那你说这叫什么事
neutral	-0.25	sample_00002635	四儿他
sad	-3.75	sample_00003061	给我一个解释你说什么都好就说你是迫不得已就说你是为了我好
neutral	0.0	sample_00003980	那当然我是他父亲他是我儿
happy	1.75	sample_00006604	听说我们家欧阳有男朋友了
angry	-3.75	sample_00006025	这样桃子妈给你出个主意你现在就到大街上去
sad	-1.75	sample_00001466	还有很多时间
surprise	-0.75	sample_00002052	这突然恶心
worried	-0.25	sample_00003484	不能这样
angry	-3.75	sample_00003724	是因为我男朋友劈腿了我才跟她分的手我这辈子最痛恨的就是第三
angry	-1.25	sample_00001038	你回来干什么
angry	-3.25	sample_00002338	这明摆着吗那个混蛋因为那个老板娘
angry	-1.75	sample_00005625	什么叫我不就要根吸管啊
worried	-2.0	sample_00000441	问题这不是我的事这是我同事的
worried	-0.5	sample_00001436	现在身体情况一直不太好我呢也不太放心我就怕他呀根本
happy	1.0	sample_00004551	奶奶是双胞胎我们家是有双胞胎遗传基因的
sad	-2.5	sample_00005164	不是他不是
worried	-1.25	sample_00006772	您就没有想过找个男朋友
angry	-3.0	sample_00004161	你是不是根本就不在乎我
angry	-3.0	sample_00005649	我这还有什么意思
worried	-2.0	sample_00000031	哦
sad	-1.5	sample_00003169	妈帮他跟着我你放心等以后条件好了我带他回去过
surprise	1.0	sample_00005605	你怎么来了
angry	-3.0	sample_00005531	你现在变得越来越不可理喻了
worried	-0.25	sample_00006127	他妈跟我说这些的时候啊我心里真的挺感动的但后来又有点心慌我会不会是做错了什么
happy	1.5	sample_00000817	乖乖
angry	-3.0	sample_00006409	此计已经订婚了你女儿第三者插足插到我们家来
worried	-0.75	sample_00000498	喝牛奶结果樊姐就说没钱买然后樊姐她妈就让樊姐去买说哪怕是全家大人饿着肚子
neutral	0.5	sample_00006981	你妈妈确实过世了但是你的
neutral	1.75	sample_00004929	我要过这种人生这种人生只有朋友能给你
worried	-1.25	sample_00003083	军哥枪给了你
worried	-2.0	sample_00006032	唉你也是为家子好持家子
neutral	0.5	sample_00002162	那是朋友的一种包含和帮助
neutral	1.5	sample_00005095	刚才不好意思不过呢从刚刚的这个小意外和大家的一片惊呼声中我想到了四个字
surprise	1.5	sample_00006523	
worried	-1.25	sample_00006629	那怎么办我我是不是要被遣送回国
angry	-2.5	sample_00003999	那我们是什么我们是苍蝇
happy	2.25	sample_00006144	您可千万别和我客气啊我跟远总关系特别好您就把我当
worried	-1.25	sample_00003937	
happy	2.0	sample_00004024	那个我妈怀我的时候吧
worried	-2.25	sample_00003049	你让我去台湾是担心形势不利
angry	-2.75	sample_00003238	婆媳七年可有的时候看一个人呢还真是一分钟就
neutral	-0.25	sample_00002473	多的卡车都要经过地棒台那是唯一的一个中心点只要在上晚班的时候把湿块扔到车厢里第二天那些运煤在卡车就会把咱们运到全省甚至更远的炉火里边烧成灰
angry	-1.75	sample_00004027	当初我说什么来着
angry	-1.25	sample_00003462	你把我推来推去你信不信
happy	2.0	sample_00000007	那就不见不散了啊好那姐
happy	3.0	sample_00006079	那我不跟你说了我得赶紧选衣服去了谢谢你啊亲爱的
sad	-3.5	sample_00001747	我真的需要人帮我我知道你是个好人
neutral	-0.25	sample_00000928	再说了人家要对你面试的呀
surprise	-2.0	sample_00006313	这么多啊
sad	-2.25	sample_00004085	你二哥的癌
happy	2.0	sample_00002426	我想大半夜能够把我们从被窝里给揪出来不是朋友是什么
happy	3.5	sample_00006861	简直就是一箭三雕呢
angry	-4.75	sample_00005864	你们根本就没想过我为什么想死啊那还是因为我觉得活着我就折磨
angry	-3.5	sample_00002276	再说了我也不是儿媳妇关他什么事啊今天也泼我一身的水这回几乎忍不了忍不了
surprise	1.0	sample_00006183	你爸的照片
worried	-1.25	sample_00005758	等到你这个新鲜劲过了以后不陪他吗对他会
neutral	-1.5	sample_00006186	忘了忘了忘了
happy	1.0	sample_00002190	公公公公公
worried	-1.75	sample_00006249	好的那你抓紧时间哦这么冷的
angry	-3.75	sample_00004956	我的手艺学三只手的手艺
happy	2.0	sample_00003180	我请了三天假来陪你
neutral	0.25	sample_00005335	是我的衣食父母
angry	-3.0	sample_00001492	瞅瞅你这个样子你就是个感情骗子你说你骗谁不行你骗要骗干净啊
surprise	4.25	sample_00002571	他活着好
happy	1.75	sample_00005867	那更好
worried	-0.75	sample_00003239	
angry	-1.5	sample_00000823	我对这个材用得非常有意见你知道吧
angry	-2.5	sample_00001655	回去你不让我回去演出
neutral	0.5	sample_00002930	多一些沟通
angry	-2.25	sample_00004485	我把王博推给家属去道歉这钱怎么道
neutral	0.25	sample_00000279	还不知道多久才好呢你先回去吧我俩打车
worried	-1.75	sample_00003828	我我不知道你你之前落过敏我就是想
angry	-3.0	sample_00002888	桃子不在家去哪儿了她都不知道这还得了啊
surprise	-0.5	sample_00000368	你是谁
sad	-4.0	sample_00000974	你以为你以为你死了就可以一了百了了
neutral	0.0	sample_00003718	你李叔那儿子镶着那姑娘
worried	-2.0	sample_00003864	老胡对不起啊你看你费劲把理给他找一份工作怎么又干出这样的事呢
happy	1.0	sample_00003252	一个人呢我有冯磊有他在的地方就是
worried	-1.5	sample_00004366	也不合适万一让他的病人看见影响他的声誉怎么办而且樊姐他爸住院赵医生帮了不少忙
angry	-2.75	sample_00003134	警告你啊冯家河你不许再跟那小子
sad	-2.75	sample_00005324	不是不是这样的当时当时我确实不是要故意把你搞丢了
surprise	-2.75	sample_00000997	死了怎么死啊
happy	2.25	sample_00003153	一定很高兴很高兴
angry	-2.25	sample_00005462	你是一而再再而三
angry	-4.0	sample_00000418	你什么时候才能学会保护自己为自己负责
sad	-3.5	sample_00004476	今天我再问你一遍尘放的死你有没有关系
angry	-3.75	sample_00004803	没话可以找话呀
happy	2.0	sample_00003017	嗯嗯李主任那个我想问问您唱歌到底有几个名字
angry	-4.5	sample_00000938	管好你儿子吧
neutral	0.25	sample_00004966	他相反的不怎么说
worried	-1.25	sample_00005110	不是你这房产证都给人家了你再要回来就跟合适吗这个
worried	-1.25	sample_00001070	他越这样我心里越慌
happy	2.0	sample_00002993	这有什么呀跟这种人在一
neutral	0.0	sample_00003578	一心两用总比你的追魂夺命扣要强
angry	-2.75	sample_00005473	别的女人被我捉到了这算不算丢了刘家
sad	-4.25	sample_00002804	但是我为了想给他要挣点钱没有能这个
neutral	0.5	sample_00004131	特别地潇洒特别的快乐我过得很心
neutral	-1.0	sample_00006191	你不是觉得在这儿不方便院父近有个咖啡馆我可以去那儿等你啊但是你下班必须
angry	-4.0	sample_00002298	那是我一分钱一分钱修车攒出来的我问你我
sad	-2.25	sample_00000276	你看
angry	-1.0	sample_00001597	把他们两个嘴堵上
worried	-1.0	sample_00001378	我要血泪教训我一定要讲给你听如果你想对一个男人太好你即使心里这么想的你也不能
neutral	0.25	sample_00005005	好像我是最有资格陪在你的身边和你共同面对这件事
angry	-4.25	sample_00006291	给我点心这骗子
angry	-2.0	sample_00004772	不要乱发评论
worried	-2.5	sample_00004456	我了解他他这个人只要是被他记恨的人他
worried	0.25	sample_00002510	这体育精神也不比那个体育成绩重要啊下个月
sad	-2.25	sample_00006679	对刘东然后我们就大吵了一架
worried	-1.75	sample_00005678	哎呀养一个孩子已经不容易了现在又怀上另外一个这真的负担
happy	2.75	sample_00000208	伯母好
worried	-2.25	sample_00004901	可你想过没有
neutral	0.0	sample_00000527	还没有准备好吧
happy	0.75	sample_00006863	就要凡是听从夫家的
neutral	-0.25	sample_00005023	哪两同伙
neutral	-0.25	sample_00005635	瞳瞳腿归我抚
neutral	-0.25	sample_00006931	都宿命般地分手了分手的具体过程和细节不为外人所道三个当事人的说法彼此出入很大老年萧军
worried	-2.25	sample_00006937	我妈到底怎么了
worried	-1.5	sample_00004033	我们全往你一个人身上喷会把人喷
neutral	0.75	sample_00001718	我想
neutral	-1.5	sample_00000650	因为这三年期间我自己也反思过
worried	-2.5	sample_00002786	晓波你好好想想你演戏越来越好
sad	-4.25	sample_00006554	嗯嗯
sad	-2.25	sample_00006548	
happy	-1.0	sample_00004462	跟这儿打这算盘的啊玩
worried	-0.25	sample_00006529	如果什么大病直接跟我说不用瞒着我有心理承受能力
surprise	-1.75	sample_00000439	啊啊
worried	-1.25	sample_00000970	来了第一天就把后厨基本上全都给开了我怀疑他是知道了成心
worried	-1.75	sample_00007018	我呀不是不愿意陪你去
happy	2.25	sample_00001865	看你现在这样我就放
angry	-4.25	sample_00003682	我没有到的原因是不管怎么说人家邵主任在第一时间跟我讲了实情
neutral	-0.5	sample_00000358	他从小是单亲家庭长大的一直跟着妈
neutral	-0.25	sample_00006445	宋琦的爸爸呀在出海的时候死了
angry	-2.5	sample_00000218	这不是三十八度还没到吗三十八度才算烧呢我是去了不是让人笑话吗
neutral	0.0	sample_00003569	不真不要他的老朋友
angry	-2.75	sample_00005146	然后盯梢要监视别在我这儿
angry	-2.25	sample_00003379	还骗人说上厕所正好
happy	2.0	sample_00005760	不过
happy	2.25	sample_00003340	不过也挺管用的你那天不是也被我给
neutral	0.0	sample_00001977	后来我老公答应要付钱
worried	-1.25	sample_00004470	我们俩现在全靠我奶奶救济呢
happy	1.5	sample_00003418	我告诉他他知道了肯定感动得死去活来
neutral	-1.75	sample_00005516	希望我能去帮他做
neutral	-1.0	sample_00004517	我想问一下咱们这老板怎么总也见不着人呢
angry	-2.5	sample_00000904	什么时候能长记性你你把他腿打折都不一定长记
neutral	-0.5	sample_00000324	
neutral	0.0	sample_00001956	哎周末你要陪小凡的父母回老家呀可以呀正好那两天我也有事有两个客户要见还要参加一个论坛好那你一路上小心点有什么事给我打电话
angry	-2.5	sample_00002294	反正我现在是看清楚了路远就是这个世界上最无耻最不要脸
sad	-4.0	sample_00001231	你这破歌我当时我跟他好的时候就唱了这歌
neutral	0.25	sample_00001913	那咱们就取个上线给五百吧
neutral	-1.5	sample_00005621	我想这个事情你也不想让其他人知道吧
angry	-2.25	sample_00003729	我们两个人过日子不是
worried	-1.25	sample_00004884	可有些事我实在没有办法
happy	1.5	sample_00001366	我想听听你还有什么样的想法
happy	2.25	sample_00004999	谢谢
happy	3.25	sample_00004300	嗯这是毛主席语录
angry	-2.5	sample_00004466	我可以陪你的我的车
angry	-2.25	sample_00000812	你是不是看见我丈夫跟那个比基尼的女人
happy	1.5	sample_00001415	那不好意思啊我一直都不知道该怎么感谢你
angry	-2.25	sample_00003229	你们两个怎么这么没有良心啊你们怎么不关心关心我呢
angry	-2.5	sample_00002544	那你现在那位极品婆婆都已经说了你为了离婚跟你爸串通起来来骗他们家的财产
worried	-1.5	sample_00000348	可是他对别人都有记忆怎么偏偏不认识我
sad	-4.0	sample_00000809	你知道爸为什么要去新疆吗
sad	-3.5	sample_00002995	你疯狂用那个样了
neutral	0.0	sample_00006572	嗯是
angry	-3.5	sample_00001641	你应该就是他嘴里说的那种全天下最恶毒的
neutral	-1.0	sample_00001191	接着你的饭碗我再跟你抢夺干净的话那就是我不是恩将仇报
angry	-2.5	sample_00002477	没想到你是警察何必骗我呢
neutral	1.25	sample_00002385	那那
angry	-2.75	sample_00001802	我告诉你们我不后悔当医生当成你们这样我宁可不当
neutral	-0.25	sample_00003534	把别人拖下水不如太踏实实地打架隔
sad	-3.0	sample_00001959	他我弟弟不确认是精神病
happy	2.25	sample_00006833	但你一定要跟我说
neutral	-0.5	sample_00003739	我很客气地跟他说话竟跟他说出实情
happy	1.0	sample_00006992	都是一家人
angry	-2.75	sample_00001039	那你也等会儿吧没工夫给你挪车我这忙
neutral	0.0	sample_00004498	他临走前对我说他很爱
angry	-2.25	sample_00003393	咱不说高健林啊
neutral	0.5	sample_00003389	看他有所作为有
worried	-1.0	sample_00003695	那怎么了
happy	2.5	sample_00000571	不上签签正说出门转身遇
worried	-0.25	sample_00005179	留下来我不知道能给你什么样的生活但是如果你愿意试试看
neutral	-0.25	sample_00005882	我觉得那已经是背水一战了
neutral	0.5	sample_00000660	领养者呢可以去看看孩子如果觉得这个孩子好
surprise	-0.75	sample_00002912	不不
angry	-3.25	sample_00006489	你相亲我相亲哪我我去
worried	-1.25	sample_00000346	孩子和女人你要
angry	-3.5	sample_00005121	烦你我那儿还一大队的事呢这是我最后一次管你们俩的事以后啊爱怎么着怎
happy	2.5	sample_00002711	喂老婆
angry	-3.5	sample_00001009	当狗当驴当畜生快打
worried	0.0	sample_00006354	对不起啊一直在忙不生气
neutral	1.25	sample_00001581	其实我的跑车也是借的所以我也是借光
neutral	-0.25	sample_00001434	南楚和那个被撞的小孩家的难处是不一样
angry	-3.25	sample_00005433	什么人哪刚才你没看见吗在医院里人家是
neutral	-1.0	sample_00001017	没准这事啊就能画上句号了可你要不去你就且琢磨
worried	-1.0	sample_00000092	把他留在这儿早
neutral	-0.25	sample_00006953	私人借款的利率半三分零
angry	-4.0	sample_00005774	是我知道这套隔壁那套是你爸你妈留给你的这是你的权利你爱租给谁租给谁行了吧我走
sad	-2.5	sample_00005097	这这这
neutral	-1.25	sample_00005054	可以只要你们觉得自己高考没问题现在就可以走
happy	0.25	sample_00002974	我觉得我可以去博物馆风景区
angry	-1.25	sample_00006699	你打挡目的我正式通知你
angry	-2.0	sample_00003436	不让女人撒娇的男人恶毒
neutral	0.25	sample_00001788	就算看中了这样的条件也是无可厚非的吧
angry	-2.5	sample_00005654	这话我怎么越来越听不明白了
angry	-2.25	sample_00006914	我这是在家呀我还穿什么正武装王的
neutral	-0.25	sample_00002728	我手机没信号了后来发现是卡坏了我这刚取
sad	-4.0	sample_00006488	老时候肯定会影响我能不
neutral	0.0	sample_00004541	去我小时候住的地方
worried	-1.0	sample_00006975	他对医生很排斥甚至是怨恨他除了艾小天他不和任何一个医生说
sad	-4.0	sample_00005513	死了
neutral	0.75	sample_00003426	嗯你就尽管放手去做吧不用考虑
worried	-1.75	sample_00002482	爸这事我知道但是薇薇那天没喝药
sad	-1.5	sample_00006740	我把衣服给你带来了穿上回家吧
neutral	0.0	sample_00006276	但是你们自己的秘密
surprise	-0.75	sample_00004900	
sad	-4.25	sample_00002344	那么会说话能感官说没永久没有了
angry	-1.0	sample_00006283	打电话问问看他今天晚上能不能接
neutral	-0.5	sample_00005102	我是担心我成你累赘不担心你成我的这赘
neutral	0.25	sample_00005340	吹进牛排的一种它的味道和它的工序一样繁
angry	-3.0	sample_00006807	还有你们曾主任一个一个地跟我说话那样子不冷不热的说真的我非常失望我对你们这些做医生的非常
